[
  {
    "message_id": "19d18717733851d0",
    "thread_id": "19d18717733851d0",
    "from": "manju@iugo.com.au",
    "from_name": "Manju Jewargi",
    "subject": "Invitation: INTERNAL - PCA Pre-meeting internal catch up @ Tue 24 Mar 2026 13:30 - 14:00 (ACDT) (Glen Rosie)",
    "received": "2026-03-23T02:06:22+00:00",
    "priority": "needs-response",
    "category": "team",
    "starred": false,
    "has_attachments": false,
    "snippet": "INTERNAL - PCA Pre-meeting internal catch up Tuesday 24 Mar 2026 13:30-14:00 Australian Central Time - Adelaide Join with Google Meet https://meet.google.com/fxj-wkpk-avj",
    "action_type": "meeting",
    "action_items": [
      "Accept or decline PCA pre-meeting internal catch-up for Tue 24 Mar 2026 13:30 ACDT"
    ],
    "suggested_action": "none"
  },
  {
    "message_id": "19d186d649873a29",
    "thread_id": "19d186cfe8693d76",
    "from": "glen@iugo.com.au",
    "from_name": "Glen Rosie",
    "subject": "Re: Agend upcoming products",
    "received": "2026-03-23T02:01:55+00:00",
    "priority": "informational",
    "category": "team",
    "starred": false,
    "has_attachments": false,
    "snippet": "Hi Manju, Thanks for reaching out about setting up a monthly catch-up with the DCA team. I've put together a few time options that should work well for establishing this regular touchpoint.",
    "action_type": "none",
    "action_items": [],
    "suggested_action": "archive"
  },
  {
    "message_id": "19d186cfe8693d76",
    "thread_id": "19d186cfe8693d76",
    "from": "manju@iugo.com.au",
    "from_name": "Manju Jewargi",
    "subject": "Agend upcoming products",
    "received": "2026-03-23T02:01:28+00:00",
    "priority": "needs-response",
    "category": "team",
    "starred": false,
    "has_attachments": false,
    "snippet": "Hi all, It was great to be introduced to you all during our meeting last week, and I'm really looking forward to working with the DCA team in my role as your Client Success Manager here at Agend.",
    "action_type": "meeting",
    "action_items": [
      "Review Manju's proposed monthly catch-up schedule with DCA team"
    ],
    "suggested_action": "archive"
  },
  {
    "message_id": "19d186cadda6b208",
    "thread_id": "19d186cadda6b208",
    "from": "melissa.king@ava.com.au",
    "from_name": "Melissa King",
    "subject": "Website meeting HOLD TBC",
    "received": "2026-03-23T02:00:39+00:00",
    "priority": "needs-response",
    "category": "client",
    "client_name": "Australian Veterinary Association",
    "client_domain": "ava.com.au",
    "starred": false,
    "has_attachments": false,
    "snippet": "Hi Team Agend (Glen and Bryce, digital designer) will take us through some preliminary thoughts post the session at the all staff meeting. We need a tight cross section of the teams for this initial p",
    "action_type": "meeting",
    "action_items": [
      "Confirm availability and attendance for AVA website preliminary meeting"
    ],
    "suggested_action": "draft-reply",
    "draft_id": "r-4184416689771581979"
  },
  {
    "message_id": "19d186967260bc5d",
    "thread_id": "19d186967260bc5d",
    "from": "no-reply@ignitionapp.com",
    "from_name": "Ignition",
    "subject": "Congratulations! RSL NSW has accepted your proposal (#PROP-0321)",
    "received": "2026-03-23T01:57:32+00:00",
    "priority": "urgent",
    "category": "admin",
    "starred": false,
    "has_attachments": false,
    "snippet": "Congratulations! Your proposal was accepted. RSL NSW has signed and accepted your proposal RSL NSW - Agend Implementation. View signed proposal",
    "action_type": "contract",
    "action_items": [
      "Kick off RSL NSW Agend Implementation project onboarding",
      "Coordinate with Manju to begin RSL NSW client onboarding"
    ],
    "suggested_action": "draft-reply",
    "draft_id": "r2828437282804578033"
  },
  {
    "message_id": "19d18673532e1f91",
    "thread_id": "19d18673532e1f91",
    "from": "notifications@github.com",
    "from_name": "Glen",
    "subject": "[iugo-glen/timesheet-reporter] Run failed: Security Scanning - main (0c0cfb0)",
    "received": "2026-03-23T01:55:09+00:00",
    "priority": "urgent",
    "category": "admin",
    "starred": false,
    "has_attachments": false,
    "snippet": "[iugo-glen/timesheet-reporter] Run failed: Security Scanning - main (0c0cfb0) Security Scanning workflow run - All jobs have failed",
    "action_type": "deadline",
    "action_items": [
      "Investigate and fix failing Security Scanning workflow in iugo-glen/timesheet-reporter"
    ],
    "suggested_action": "none"
  },
  {
    "message_id": "19d18594d0474791",
    "thread_id": "19d18594d0474791",
    "from": "no-reply@ignitionapp.com",
    "from_name": "Ignition",
    "subject": "Congratulations! Australian Veterinary Association (AVA) has accepted your proposal (#PROP-0320)",
    "received": "2026-03-23T01:39:56+00:00",
    "priority": "urgent",
    "category": "client",
    "client_name": "Australian Veterinary Association",
    "client_domain": "ava.com.au",
    "starred": false,
    "has_attachments": false,
    "snippet": "Congratulations! Your proposal was accepted. Australian Veterinary Association (AVA) has signed and accepted your proposal AVA - Agend Implementation. View signed proposal",
    "action_type": "contract",
    "action_items": [
      "Kick off AVA Agend Implementation project onboarding"
    ],
    "suggested_action": "forward-to-team"
  },
  {
    "message_id": "19d1854409135d23",
    "thread_id": "19d1853da19e26c3",
    "from": "glen@iugo.com.au",
    "from_name": "Glen Rosie",
    "subject": "Re: Agend x VMA - Website updates and Project next steps",
    "received": "2026-03-23T01:34:27+00:00",
    "priority": "informational",
    "category": "team",
    "starred": false,
    "has_attachments": false,
    "snippet": "Hi Manju, Thanks for the comprehensive update and recap. Looks like the project is tracking well and the action items are clear. I'm happy with the timeline and next steps outlined.",
    "action_type": "none",
    "action_items": [],
    "suggested_action": "archive"
  },
  {
    "message_id": "19d1853da19e26c3",
    "thread_id": "19d1853da19e26c3",
    "from": "manju@iugo.com.au",
    "from_name": "Manju Jewargi",
    "subject": "Agend x VMA - Website updates and Project next steps",
    "received": "2026-03-23T01:34:01+00:00",
    "priority": "informational",
    "category": "team",
    "starred": false,
    "has_attachments": false,
    "snippet": "Hi all, Thanks for meeting with us last week! It was a really useful session, and great to be aligned on what needs to happen next. Quick recap: the project is close to completion.",
    "action_type": "none",
    "action_items": [],
    "suggested_action": "archive"
  },
  {
    "message_id": "19d1852159328c6f",
    "thread_id": "19d1852159328c6f",
    "from": "no-reply@ignitionapp.com",
    "from_name": "Ignition",
    "subject": "Congratulations! Occupational Therapy Australia (OTA) has accepted your proposal (#PROP-0319)",
    "received": "2026-03-23T01:32:03+00:00",
    "priority": "urgent",
    "category": "client",
    "client_name": "Occupational Therapy Australia",
    "client_domain": "otaus.com.au",
    "starred": false,
    "has_attachments": false,
    "snippet": "Congratulations! Your proposal was accepted. Occupational Therapy Australia (OTA) has signed and accepted your proposal Agend Implementation. View signed proposal",
    "action_type": "contract",
    "action_items": [
      "Kick off OTA Agend Implementation project onboarding",
      "Notify Alex Reynolds to begin OTA onboarding"
    ],
    "suggested_action": "forward-to-team"
  },
  {
    "message_id": "19d1842d4e03f64b",
    "thread_id": "19d1842d4e03f64b",
    "from": "marketing@adelaidedirectstationers.com.au",
    "from_name": "Adelaide Direct Stationers",
    "subject": "Don't Miss Our Easter Giveaway!",
    "received": "2026-03-23T01:14:52+00:00",
    "priority": "low-priority",
    "category": "noise",
    "starred": false,
    "has_attachments": false,
    "snippet": "Easter Giveaway promotional email from Adelaide Direct Stationers",
    "action_type": "none",
    "action_items": [],
    "suggested_action": "archive"
  },
  {
    "message_id": "19d18401457b7d7a",
    "thread_id": "19d17c8e63ca79c1",
    "from": "gdavenport@propertycouncil.com.au",
    "from_name": "Greg Davenport",
    "subject": "Re: Agend x PCA Shopping Centre Online - SOW Review & Finalisation Meeting",
    "received": "2026-03-23T01:11:58+00:00",
    "priority": "urgent",
    "category": "client",
    "client_name": "Property Council Australia",
    "client_domain": "propertycouncil.com.au",
    "starred": false,
    "has_attachments": true,
    "snippet": "Hi Manju Please see attached SOW updated with our comments and questions - for discussion tomorrow. Cheers Greg Davenport | Senior Functional Analyst Property Council of Australia",
    "action_type": "contract",
    "action_items": [
      "Review PCA updated SOW with comments before Tuesday meeting",
      "Prepare responses to PCA questions on SOW"
    ],
    "suggested_action": "review-attachment",
    "draft_id": "r-6625747649325110655"
  },
  {
    "message_id": "19d18373c3b4a0ee",
    "thread_id": "19d18373c3b4a0ee",
    "from": "admin@iugo.com.au",
    "from_name": "'Property Council Awards' via admin",
    "subject": "Innovation & Excellence Awards nominations now open",
    "received": "2026-03-23T01:02:43+00:00",
    "priority": "informational",
    "category": "admin",
    "starred": false,
    "has_attachments": false,
    "snippet": "Property Council Innovation & Excellence Awards nominations are now open",
    "action_type": "deadline",
    "action_items": [],
    "suggested_action": "archive"
  },
  {
    "message_id": "19d1827d4b02508d",
    "thread_id": "19cdec9f4bcc953d",
    "from": "glen@agend.com.au",
    "from_name": "Glen Rosie",